{
  "texture": "storybound:textures/gui/document/book_leather.png",
  "width": 320,
  "height": 200,
  "padding": { "left": 16, "top": 14, "right": 16, "bottom": 26 },
  "font": "storybound:document",
  "color": "#2e2216",
  "line_height": 10,
  "show_title": true,
  "open_sound": "minecraft:item.book.page_turn",
  "turn_sound": "minecraft:item.book.page_turn"
}
